{
  "assetId": "01HQZX3F5G7K9M2N4P6R8S0V2A",
  "envelope": {
    "schemaVersion": "1.0.0",
    "createdAt": "2026-07-21T04:30:00Z",
    "createdBy": { "kind": "skill", "skill": "ingest", "skillVersion": "1.0.0" }
  },
  "jobId": "test-1",
  "relativePath": "clean.mp4",
  "assetKind": "video",
  "sourceClassification": "fixture",
  "contentHash": {
    "algorithm": "sha256",
    "value": "a1b2c3d4a1b2c3d4a1b2c3d4a1b2c3d4a1b2c3d4a1b2c3d4a1b2c3d4a1b2c3d4"
  },
  "byteSize": 289290,
  "storedPath": "source/a1b2c3d4a1b2c3d4a1b2c3d4a1b2c3d4a1b2c3d4a1b2c3d4a1b2c3d4a1b2c3d4.mp4",
  "rights": {
    "state": "cleared",
    "owner": "Cutdown fixture corpus",
    "supplier": "Synthetic (ffmpeg lavfi)",
    "permittedPlatforms": ["tiktok", "instagram_reels", "youtube_shorts", "linkedin"],
    "territories": ["AU"],
    "campaignStart": "2026-01-01",
    "campaignEnd": null,
    "expiryDate": null,
    "talentReleaseStatus": "not_required",
    "locationReleaseStatus": "not_required",
    "musicStatus": "none",
    "editingPermitted": true,
    "paidAmplificationPermitted": true,
    "evidenceUri": "file:./LICENSE-FIXTURES.md",
    "notes": "Synthetically generated by ffmpeg from built-in sources; no third-party rights attach."
  },
  "preflight": {
    "inspected": true,
    "container": { "formatName": "mov,mp4,m4a,3gp,3g2,mj2", "formatLongName": "QuickTime / MOV" },
    "duration": { "ticks": 75000, "timebase": { "num": 1, "den": 15360 } },
    "video": {
      "codecName": "h264",
      "profile": "High",
      "pixelFormat": "yuv420p",
      "codedWidth": 640,
      "codedHeight": 360,
      "displayWidth": 640,
      "displayHeight": 360,
      "rotationDegrees": 0,
      "averageFrameRate": { "num": 30, "den": 1 },
      "realFrameRate": { "num": 30, "den": 1 },
      "frameRateMode": "cfr",
      "timebase": { "num": 1, "den": 15360 },
      "frameCount": 150,
      "color": { "space": "bt709", "primaries": "bt709", "transfer": "bt709", "range": "tv" },
      "hdr": { "isHdr": false, "detectedFormat": null }
    },
    "audioTracks": [
      {
        "streamIndex": 1,
        "codecName": "aac",
        "sampleRate": 48000,
        "channels": 1,
        "channelLayout": "mono",
        "timebase": { "num": 1, "den": 48000 },
        "durationTicks": 240000
      }
    ],
    "corruption": { "status": "clean", "detail": null, "decodeErrorCount": 0 }
  },
  "proxy": {
    "storedPath": "proxy/a1b2c3d4a1b2c3d4a1b2c3d4a1b2c3d4a1b2c3d4a1b2c3d4a1b2c3d4a1b2c3d4.mp4",
    "contentHash": {
      "algorithm": "sha256",
      "value": "b2c3d4e5b2c3d4e5b2c3d4e5b2c3d4e5b2c3d4e5b2c3d4e5b2c3d4e5b2c3d4e5"
    },
    "proxyProfileVersion": "1.0.0",
    "recipe": {
      "shortEdgeMaxPixels": 720,
      "videoCodec": "libx264",
      "crf": 23,
      "audioCodec": "aac",
      "audioBitrateKbps": 128,
      "constantFrameRate": { "num": 30, "den": 1 }
    },
    "timebase": { "num": 1, "den": 15360 }
  }
}
