{
  "assetId": "01KZ07N9Z3KTZFWC12FZYPMNS0",
  "envelope": {
    "schemaVersion": "1.0.0",
    "createdAt": "2026-08-02T03:18:11.683Z",
    "createdBy": {
      "kind": "skill",
      "skill": "ingest",
      "skillVersion": "1.0.0"
    }
  },
  "jobId": "e2e-mixed-1",
  "relativePath": "brand-logo.png",
  "assetKind": "logo",
  "sourceClassification": "fixture",
  "contentHash": {
    "algorithm": "sha256",
    "value": "12f3cccab4eabc8fb6134dcab02505def2f369311b0089d48d2d27f11e9b937c"
  },
  "byteSize": 9801,
  "storedPath": "source/12f3cccab4eabc8fb6134dcab02505def2f369311b0089d48d2d27f11e9b937c.png",
  "rights": {
    "state": "cleared",
    "owner": "Cutdown fixture corpus",
    "supplier": "Synthetic (ffmpeg lavfi)",
    "permittedPlatforms": [
      "tiktok",
      "instagram_reels",
      "youtube_shorts",
      "linkedin"
    ],
    "territories": [
      "AU"
    ],
    "campaignStart": "2026-01-01",
    "campaignEnd": null,
    "expiryDate": null,
    "talentReleaseStatus": "not_required",
    "locationReleaseStatus": "not_required",
    "musicStatus": "none",
    "editingPermitted": true,
    "paidAmplificationPermitted": true,
    "evidenceUri": "file:../LICENSE-FIXTURES.md",
    "notes": "Synthetically generated by ffmpeg (drawtext over a transparent RGBA base); no third-party rights attach."
  },
  "preflight": {
    "inspected": true,
    "container": {
      "formatName": "png_pipe",
      "formatLongName": "piped png sequence"
    },
    "duration": null,
    "video": {
      "codecName": "png",
      "profile": null,
      "pixelFormat": "rgba",
      "codedWidth": 512,
      "codedHeight": 512,
      "displayWidth": 512,
      "displayHeight": 512,
      "rotationDegrees": 0,
      "averageFrameRate": {
        "num": 25,
        "den": 1
      },
      "realFrameRate": {
        "num": 25,
        "den": 1
      },
      "frameRateMode": "cfr",
      "timebase": {
        "num": 1,
        "den": 25
      },
      "frameCount": null,
      "color": {
        "space": "gbr",
        "primaries": null,
        "transfer": null,
        "range": "pc"
      },
      "hdr": {
        "isHdr": false,
        "detectedFormat": null
      }
    },
    "audioTracks": [],
    "corruption": {
      "status": "clean",
      "detail": null,
      "decodeErrorCount": 0
    }
  },
  "proxy": null
}
