{
  "assetId": "01KZ07NAM2ER633ZCBSGJX8ENY",
  "envelope": {
    "schemaVersion": "1.0.0",
    "createdAt": "2026-08-02T03:18:12.354Z",
    "createdBy": {
      "kind": "skill",
      "skill": "ingest",
      "skillVersion": "1.0.0"
    }
  },
  "jobId": "e2e-mixed-1",
  "relativePath": "captions.srt",
  "assetKind": "subtitle",
  "sourceClassification": "fixture",
  "contentHash": {
    "algorithm": "sha256",
    "value": "b489764a2bd1a23929926919d551f8ac1de6db6568c9f0bf5cb030e4987a77b9"
  },
  "byteSize": 227,
  "storedPath": "source/b489764a2bd1a23929926919d551f8ac1de6db6568c9f0bf5cb030e4987a77b9.srt",
  "rights": {
    "state": "cleared",
    "owner": "Cutdown fixture corpus",
    "supplier": "Synthetic (ffmpeg lavfi)",
    "permittedPlatforms": [
      "tiktok",
      "instagram_reels",
      "youtube_shorts",
      "linkedin"
    ],
    "territories": [
      "AU"
    ],
    "campaignStart": "2026-01-01",
    "campaignEnd": null,
    "expiryDate": null,
    "talentReleaseStatus": "not_required",
    "locationReleaseStatus": "not_required",
    "musicStatus": "none",
    "editingPermitted": true,
    "paidAmplificationPermitted": true,
    "evidenceUri": "file:../LICENSE-FIXTURES.md",
    "notes": "Hand-written plain-text cue file authored for this fixture corpus; no third-party rights attach."
  },
  "preflight": {
    "inspected": true,
    "container": null,
    "duration": null,
    "video": null,
    "audioTracks": [],
    "corruption": null
  },
  "proxy": null
}
