{
  "assetId": "01KZ087TS6X67NY8JDQE3A16KD",
  "envelope": {
    "schemaVersion": "1.0.0",
    "createdAt": "2026-08-02T03:28:18.727Z",
    "createdBy": {
      "kind": "skill",
      "skill": "ingest",
      "skillVersion": "1.0.0"
    }
  },
  "jobId": "e2e-mixed-1",
  "relativePath": "promo-take.mp4",
  "assetKind": "video",
  "sourceClassification": "fixture",
  "contentHash": {
    "algorithm": "sha256",
    "value": "58fb3b9819a30be024eff82503691dcfeef5637790f533eecee26389445e0561"
  },
  "byteSize": 1471821,
  "storedPath": "source/58fb3b9819a30be024eff82503691dcfeef5637790f533eecee26389445e0561.mp4",
  "rights": {
    "state": "cleared",
    "owner": "Cutdown fixture corpus",
    "supplier": "Synthetic (ffmpeg lavfi)",
    "permittedPlatforms": [
      "tiktok",
      "instagram_reels",
      "youtube_shorts",
      "linkedin"
    ],
    "territories": [
      "AU"
    ],
    "campaignStart": "2026-01-01",
    "campaignEnd": null,
    "expiryDate": null,
    "talentReleaseStatus": "not_required",
    "locationReleaseStatus": "not_required",
    "musicStatus": "none",
    "editingPermitted": true,
    "paidAmplificationPermitted": true,
    "evidenceUri": "file:../../ingest/LICENSE-FIXTURES.md",
    "notes": "Synthetically generated by ffmpeg (testsrc2 video + flite synthesised speech, five utterances separated by 1.6 s silence). No real footage, no human voice, no performer rights. Generated for the Phase 6 end-to-end proving run."
  },
  "preflight": {
    "inspected": true,
    "container": {
      "formatName": "mov,mp4,m4a,3gp,3g2,mj2",
      "formatLongName": "QuickTime / MOV"
    },
    "duration": {
      "ticks": 414720,
      "timebase": {
        "num": 1,
        "den": 15360
      }
    },
    "video": {
      "codecName": "h264",
      "profile": "High",
      "pixelFormat": "yuv420p",
      "codedWidth": 640,
      "codedHeight": 360,
      "displayWidth": 640,
      "displayHeight": 360,
      "rotationDegrees": 0,
      "averageFrameRate": {
        "num": 30,
        "den": 1
      },
      "realFrameRate": {
        "num": 30,
        "den": 1
      },
      "frameRateMode": "cfr",
      "timebase": {
        "num": 1,
        "den": 15360
      },
      "frameCount": 810,
      "color": {
        "space": null,
        "primaries": null,
        "transfer": null,
        "range": null
      },
      "hdr": {
        "isHdr": false,
        "detectedFormat": null
      }
    },
    "audioTracks": [
      {
        "streamIndex": 1,
        "codecName": "aac",
        "sampleRate": 48000,
        "channels": 1,
        "channelLayout": "mono",
        "timebase": {
          "num": 1,
          "den": 48000
        },
        "durationTicks": 1296000
      }
    ],
    "corruption": {
      "status": "clean",
      "detail": null,
      "decodeErrorCount": 0
    }
  },
  "proxy": {
    "storedPath": "proxy/58fb3b9819a30be024eff82503691dcfeef5637790f533eecee26389445e0561.mp4",
    "contentHash": {
      "algorithm": "sha256",
      "value": "58208d52985cdc44fd3b9faf0c9eaf722c1322bfa7b7acb4eb4c1b87ddad9bdd"
    },
    "proxyProfileVersion": "1.0.0",
    "recipe": {
      "shortEdgeMaxPixels": 720,
      "videoCodec": "h264",
      "crf": 23,
      "audioCodec": "aac",
      "audioBitrateKbps": 128,
      "constantFrameRate": {
        "num": 30,
        "den": 1
      }
    },
    "timebase": {
      "num": 1,
      "den": 15360
    }
  }
}
