{
  "assetId": "01KZ07NAKW18AQVA4T4PZSSH3M",
  "envelope": {
    "schemaVersion": "1.0.0",
    "createdAt": "2026-08-02T03:18:12.348Z",
    "createdBy": {
      "kind": "skill",
      "skill": "ingest",
      "skillVersion": "1.0.0"
    }
  },
  "jobId": "e2e-mixed-1",
  "relativePath": "café shot.mp4",
  "assetKind": "video",
  "sourceClassification": "fixture",
  "contentHash": {
    "algorithm": "sha256",
    "value": "dfb8daf232001956781e0e01570a4183e3322529ab5167d5946b24ddf521e934"
  },
  "byteSize": 284595,
  "storedPath": "source/dfb8daf232001956781e0e01570a4183e3322529ab5167d5946b24ddf521e934.mp4",
  "rights": {
    "state": "cleared",
    "owner": "Cutdown fixture corpus",
    "supplier": "Synthetic (ffmpeg lavfi)",
    "permittedPlatforms": [
      "tiktok",
      "instagram_reels",
      "youtube_shorts",
      "linkedin"
    ],
    "territories": [
      "AU"
    ],
    "campaignStart": "2026-01-01",
    "campaignEnd": null,
    "expiryDate": null,
    "talentReleaseStatus": "not_required",
    "locationReleaseStatus": "not_required",
    "musicStatus": "none",
    "editingPermitted": true,
    "paidAmplificationPermitted": true,
    "evidenceUri": "file:../LICENSE-FIXTURES.md",
    "notes": "Synthetically generated by ffmpeg from built-in sources (testsrc2 video, flite TTS audio); no third-party rights attach."
  },
  "preflight": {
    "inspected": true,
    "container": {
      "formatName": "mov,mp4,m4a,3gp,3g2,mj2",
      "formatLongName": "QuickTime / MOV"
    },
    "duration": {
      "ticks": 76800,
      "timebase": {
        "num": 1,
        "den": 15360
      }
    },
    "video": {
      "codecName": "h264",
      "profile": "High",
      "pixelFormat": "yuv420p",
      "codedWidth": 640,
      "codedHeight": 360,
      "displayWidth": 640,
      "displayHeight": 360,
      "rotationDegrees": 0,
      "averageFrameRate": {
        "num": 30,
        "den": 1
      },
      "realFrameRate": {
        "num": 30,
        "den": 1
      },
      "frameRateMode": "cfr",
      "timebase": {
        "num": 1,
        "den": 15360
      },
      "frameCount": 150,
      "color": {
        "space": null,
        "primaries": null,
        "transfer": null,
        "range": null
      },
      "hdr": {
        "isHdr": false,
        "detectedFormat": null
      }
    },
    "audioTracks": [
      {
        "streamIndex": 1,
        "codecName": "aac",
        "sampleRate": 48000,
        "channels": 1,
        "channelLayout": "mono",
        "timebase": {
          "num": 1,
          "den": 48000
        },
        "durationTicks": 240000
      }
    ],
    "corruption": {
      "status": "clean",
      "detail": null,
      "decodeErrorCount": 0
    }
  },
  "proxy": {
    "storedPath": "proxy/dfb8daf232001956781e0e01570a4183e3322529ab5167d5946b24ddf521e934.mp4",
    "contentHash": {
      "algorithm": "sha256",
      "value": "7bf492909ce866804e9dff2bee2a7cdfa68820bd7d663ae254e11b3728141536"
    },
    "proxyProfileVersion": "1.0.0",
    "recipe": {
      "shortEdgeMaxPixels": 720,
      "videoCodec": "h264",
      "crf": 23,
      "audioCodec": "aac",
      "audioBitrateKbps": 128,
      "constantFrameRate": {
        "num": 30,
        "den": 1
      }
    },
    "timebase": {
      "num": 1,
      "den": 15360
    }
  }
}
