{
  "assetId": "01KZ07NAWQ4PDQG3TH5DHM73VM",
  "envelope": {
    "schemaVersion": "1.0.0",
    "createdAt": "2026-08-02T03:18:12.631Z",
    "createdBy": {
      "kind": "skill",
      "skill": "ingest",
      "skillVersion": "1.0.0"
    }
  },
  "jobId": "e2e-mixed-1",
  "relativePath": "voiceover-bed.m4a",
  "assetKind": "audio",
  "sourceClassification": "fixture",
  "contentHash": {
    "algorithm": "sha256",
    "value": "3ec23f6b5c9a4edc5f367ccea5b085b6a4349668dfb7779f2af99de5bec59821"
  },
  "byteSize": 62252,
  "storedPath": "source/3ec23f6b5c9a4edc5f367ccea5b085b6a4349668dfb7779f2af99de5bec59821.m4a",
  "rights": {
    "state": "cleared",
    "owner": "Cutdown fixture corpus",
    "supplier": "Synthetic (ffmpeg lavfi)",
    "permittedPlatforms": [
      "tiktok",
      "instagram_reels",
      "youtube_shorts",
      "linkedin"
    ],
    "territories": [
      "AU"
    ],
    "campaignStart": "2026-01-01",
    "campaignEnd": null,
    "expiryDate": null,
    "talentReleaseStatus": "not_required",
    "locationReleaseStatus": "not_required",
    "musicStatus": "none",
    "editingPermitted": true,
    "paidAmplificationPermitted": true,
    "evidenceUri": "file:../LICENSE-FIXTURES.md",
    "notes": "Synthetically generated by ffmpeg from built-in sources (sine + anoisesrc mix); not a music bed under licence - musicStatus none because the tone is generated, not licensed."
  },
  "preflight": {
    "inspected": true,
    "container": {
      "formatName": "mov,mp4,m4a,3gp,3g2,mj2",
      "formatLongName": "QuickTime / MOV"
    },
    "duration": {
      "ticks": 240000,
      "timebase": {
        "num": 1,
        "den": 48000
      }
    },
    "video": null,
    "audioTracks": [
      {
        "streamIndex": 0,
        "codecName": "aac",
        "sampleRate": 48000,
        "channels": 1,
        "channelLayout": "mono",
        "timebase": {
          "num": 1,
          "den": 48000
        },
        "durationTicks": 240000
      }
    ],
    "corruption": {
      "status": "clean",
      "detail": null,
      "decodeErrorCount": 0
    }
  },
  "proxy": null
}
